{
  "schema_version": 1,
  "mode": "user-capture",
  "version": {
    "channel": "live",
    "game_version": "12.0.8",
    "api_version": 101050,
    "catalog_version": "s073-capture",
    "catalog_schema": 1,
    "locales": [
      "en"
    ],
    "tool_version": "0.19.0"
  },
  "input_source": "invented-capture",
  "source_policy": "docs/project/catalog-sources.json",
  "sources": [
    {
      "id": "invented-capture",
      "role": "collector-capture",
      "channel": "live",
      "game_version": "12.0.8",
      "api_version": 101050,
      "locale": "en",
      "revision": "0981ad6bb2497b789d3cbc09e3c5eba3d99987d309515ec57a50cb65998d3af4",
      "sha256": "28a105fda81e1f4ae58d1c1d0d2ab5f61a02e383c939a892c385a9f7637d0f6b",
      "max_bytes": 134217728,
      "uri": "user-local-savedvariables",
      "local_path": "specs/092-data-addon-foundation/fixtures/catalog-live-canonical.lua",
      "license_scope": "user-generated-local-only",
      "redistribution": "user-generated-only"
    }
  ],
  "network": {
    "enabled": false,
    "refresh": false,
    "allow_stale_cache": false
  },
  "baseline": null,
  "icon_source": null,
  "thresholds": {
    "entities_removed": 0,
    "localized_text_removed": 0,
    "relations_removed": 0,
    "coverage_removed": 0,
    "icon_references_removed": 0
  }
}
