{
  "schema_version": 1,
  "mode": "pts",
  "version": {
    "channel": "pts",
    "game_version": "12.1.4",
    "api_version": 101051,
    "catalog_version": "s070-pts-1",
    "catalog_schema": 1,
    "locales": ["en-US"],
    "tool_version": "s070-v1"
  },
  "input_source": "invented-pts-bundle",
  "source_policy": "docs/project/catalog-sources.json",
  "sources": [{
    "id": "invented-pts-bundle",
    "role": "normalized-bundle",
    "channel": "pts",
    "game_version": "12.1.4",
    "api_version": 101051,
    "locale": "en-US",
    "revision": "s070-fixture-1",
    "sha256": "4b17a51a5f0a0ab07bbc92743ebb163ccbdc26c0118f5c5fcf5171393f91f990",
    "max_bytes": 67108864,
    "uri": "project://specs/070/minimal-pts",
    "local_path": "specs/070-catalog-compiler/fixtures/minimal-pts.json",
    "license_scope": "project-authored-synthetic",
    "redistribution": "allowed"
  }, {
    "id": "synthetic-pts",
    "role": "provenance",
    "channel": "pts",
    "game_version": "12.1.4",
    "api_version": 101051,
    "locale": "en-US",
    "revision": "s070-fixture-1",
    "sha256": "e3b0c44298fc1c149afbf4c8996fb92427ae41e4649b934ca495991b7852b855",
    "max_bytes": 1,
    "uri": "project://specs/070/minimal-pts-source",
    "local_path": "specs/073-reviewed-catalog-pipeline/fixtures/empty-source.bin",
    "license_scope": "project-authored-synthetic",
    "redistribution": "allowed"
  }],
  "network": {"enabled": false, "refresh": false, "allow_stale_cache": false},
  "baseline": null,
  "icon_source": null,
  "thresholds": {"entities_removed": 0, "localized_text_removed": 0, "relations_removed": 0, "coverage_removed": 0, "icon_references_removed": 0}
}
